{
  "version": 1,
  "run_a": "20261016T104512Z",
  "run_b": "20261016T113020Z",
  "created_at": "2026-10-16T11:31:00Z",
  "commit_a": "a4caeec",
  "commit_b": "cbe4d40",
  "summary": {
    "fixed": 1,
    "regressed": 0,
    "still_failing": 0,
    "still_passing": 2,
    "added": 0,
    "removed": 0,
    "changed_other": 0
  },
  "tests": [
    {
      "test_id": "editor-creates-ticket",
      "change": "still-passing",
      "status_a": "passed",
      "status_b": "passed",
      "duration_delta_ms": -300
    },
    {
      "test_id": "short-title-rejected",
      "change": "fixed",
      "status_a": "failed",
      "status_b": "passed",
      "failing_step_a": 2,
      "notes": "The plan was updated to assert the input validity state."
    },
    {
      "test_id": "viewer-cannot-create",
      "change": "still-passing",
      "status_a": "passed",
      "status_b": "passed"
    }
  ]
}
